{"schema":"urn:firmwaresight:schema:analysis:1","schemaVersion":1,"snapshot":{"snapshotId":"snap-4b4087e1407ceddcb1e1cfcd978eedbc8906cf88083ba3b4672c7c225ddd8374-p0-normalize-1-a38575cd51ec2730442a0f3b8506c99fc49eec68d4b28ecdc9dda9434709ace6","fwsightVersion":"0.6.0","normalizationVersion":"p0-normalize-1"},"artifacts":[{"fileName":"firmware.elf","kind":"elf","sha256":"4b4087e1407ceddcb1e1cfcd978eedbc8906cf88083ba3b4672c7c225ddd8374","byteSize":17464,"parserId":"object-elf/0.40","architecture":"Arm","bitness":"32","endianness":"little","entryPoint":"0x8000049","entryPointUnknownReason":null,"buildId":null,"buildIdUnknownReason":"no .note.gnu.build-id section is present"},{"fileName":"firmware.map","kind":"map","sha256":"a38575cd51ec2730442a0f3b8506c99fc49eec68d4b28ecdc9dda9434709ace6","byteSize":4664,"parserId":"map-adapter/gnu_ld","architecture":"Unknown","bitness":"unknown","endianness":"unknown","entryPoint":null,"entryPointUnknownReason":"a linker MAP records addresses, not an entry point","buildId":null,"buildIdUnknownReason":"a linker MAP carries no build-id"}],"memory":{"accountingRule":"adr-0021-dual-budget","layoutSource":"map","weakestEvidenceBasis":"map-memory-configuration+elf-load","admissibleForHardBlock":true,"nonvolatileImageFootprint":{"state":"exact","classification":"observed","bytes":376,"unattributed":[],"reason":null},"runtimeRamFootprint":{"state":"exact","classification":"observed","bytes":76,"unattributed":[],"reason":null},"contributions":[{"sectionLocator":"elf.section_header[1]","sectionName":".text","nonvolatileBytes":212,"runtimeRamBytes":0,"evidenceBasis":"map-memory-configuration+elf-load","classification":"observed","accountingRule":"map-memory-configuration+elf-load","dualAccounted":false},{"sectionLocator":"elf.section_header[2]","sectionName":".rodata","nonvolatileBytes":32,"runtimeRamBytes":0,"evidenceBasis":"map-memory-configuration+elf-load","classification":"observed","accountingRule":"map-memory-configuration+elf-load","dualAccounted":false},{"sectionLocator":"elf.section_header[3]","sectionName":".settings","nonvolatileBytes":64,"runtimeRamBytes":0,"evidenceBasis":"map-memory-configuration+elf-load","classification":"observed","accountingRule":"map-memory-configuration+elf-load","dualAccounted":false},{"sectionLocator":"elf.section_header[4]","sectionName":".data","nonvolatileBytes":4,"runtimeRamBytes":4,"evidenceBasis":"map-memory-configuration+elf-load","classification":"observed","accountingRule":"map-memory-configuration+elf-load","dualAccounted":true},{"sectionLocator":"elf.section_header[5]","sectionName":".bss","nonvolatileBytes":0,"runtimeRamBytes":8,"evidenceBasis":"map-memory-configuration+elf-load","classification":"observed","accountingRule":"map-memory-configuration+elf-load","dualAccounted":false},{"sectionLocator":"elf.section_header[6]","sectionName":".ota","nonvolatileBytes":64,"runtimeRamBytes":64,"evidenceBasis":"map-memory-configuration+elf-load","classification":"observed","accountingRule":"map-memory-configuration+elf-load","dualAccounted":true}],"excludedMetadataBytes":4294,"dualAccountedSections":["elf.section_header[4]","elf.section_header[6]"]},"sections":[{"index":1,"name":".text","nameUnknownReason":null,"role":"code","flags":{"alloc":true,"execute":true,"write":false,"merge":false,"strings":false,"tls":false,"compressed":false},"virtualAddress":"0x8000000","virtualAddressUnknownReason":null,"loadAddress":"0x8000000","loadAddressUnknownReason":null,"fileOffset":"0x1000","fileOffsetUnknownReason":null,"fileSize":212,"memorySize":212,"memorySizeUnknownReason":null,"region":"ROM","regionUnknownReason":null},{"index":2,"name":".rodata","nameUnknownReason":null,"role":"read-only-data","flags":{"alloc":true,"execute":false,"write":false,"merge":false,"strings":false,"tls":false,"compressed":false},"virtualAddress":"0x80000d4","virtualAddressUnknownReason":null,"loadAddress":"0x80000d4","loadAddressUnknownReason":null,"fileOffset":"0x10d4","fileOffsetUnknownReason":null,"fileSize":32,"memorySize":32,"memorySizeUnknownReason":null,"region":"ROM","regionUnknownReason":null},{"index":3,"name":".settings","nameUnknownReason":null,"role":"read-only-data","flags":{"alloc":true,"execute":false,"write":false,"merge":false,"strings":false,"tls":false,"compressed":false},"virtualAddress":"0x8010000","virtualAddressUnknownReason":null,"loadAddress":"0x8010000","loadAddressUnknownReason":null,"fileOffset":"0x2000","fileOffsetUnknownReason":null,"fileSize":64,"memorySize":64,"memorySizeUnknownReason":null,"region":"ROM","regionUnknownReason":null},{"index":4,"name":".data","nameUnknownReason":null,"role":"initialized-data","flags":{"alloc":true,"execute":false,"write":true,"merge":false,"strings":false,"tls":false,"compressed":false},"virtualAddress":"0x20000000","virtualAddressUnknownReason":null,"loadAddress":"0x8010040","loadAddressUnknownReason":null,"fileOffset":"0x3000","fileOffsetUnknownReason":null,"fileSize":4,"memorySize":4,"memorySizeUnknownReason":null,"region":"RAM","regionUnknownReason":null},{"index":5,"name":".bss","nameUnknownReason":null,"role":"uninitialized-data","flags":{"alloc":true,"execute":false,"write":true,"merge":false,"strings":false,"tls":false,"compressed":false},"virtualAddress":"0x20000004","virtualAddressUnknownReason":null,"loadAddress":"0x8010044","loadAddressUnknownReason":null,"fileOffset":null,"fileOffsetUnknownReason":"the section has no file range; it occupies no bytes on disk","fileSize":0,"memorySize":8,"memorySizeUnknownReason":null,"region":"RAM","regionUnknownReason":null},{"index":6,"name":".ota","nameUnknownReason":null,"role":"initialized-data","flags":{"alloc":true,"execute":false,"write":true,"merge":false,"strings":false,"tls":false,"compressed":false},"virtualAddress":"0x2000000c","virtualAddressUnknownReason":null,"loadAddress":"0x8010044","loadAddressUnknownReason":null,"fileOffset":"0x300c","fileOffsetUnknownReason":null,"fileSize":64,"memorySize":64,"memorySizeUnknownReason":null,"region":"RAM","regionUnknownReason":null},{"index":7,"name":".debug_info","nameUnknownReason":null,"role":"debug","flags":{"alloc":false,"execute":false,"write":false,"merge":false,"strings":false,"tls":false,"compressed":false},"virtualAddress":null,"virtualAddressUnknownReason":"this section is host metadata and is not loaded at runtime","loadAddress":"0x0","loadAddressUnknownReason":null,"fileOffset":"0x304c","fileOffsetUnknownReason":null,"fileSize":910,"memorySize":910,"memorySizeUnknownReason":null,"region":"*default*","regionUnknownReason":null},{"index":8,"name":".debug_abbrev","nameUnknownReason":null,"role":"debug","flags":{"alloc":false,"execute":false,"write":false,"merge":false,"strings":false,"tls":false,"compressed":false},"virtualAddress":null,"virtualAddressUnknownReason":"this section is host metadata and is not loaded at runtime","loadAddress":"0x0","loadAddressUnknownReason":null,"fileOffset":"0x33da","fileOffsetUnknownReason":null,"fileSize":518,"memorySize":518,"memorySizeUnknownReason":null,"region":"*default*","regionUnknownReason":null},{"index":9,"name":".debug_loclists","nameUnknownReason":null,"role":"debug","flags":{"alloc":false,"execute":false,"write":false,"merge":false,"strings":false,"tls":false,"compressed":false},"virtualAddress":null,"virtualAddressUnknownReason":"this section is host metadata and is not loaded at runtime","loadAddress":null,"loadAddressUnknownReason":"not present in the section header table","fileOffset":"0x35e0","fileOffsetUnknownReason":null,"fileSize":414,"memorySize":414,"memorySizeUnknownReason":null,"region":null,"regionUnknownReason":"no memory-region evidence was supplied"},{"index":10,"name":".debug_aranges","nameUnknownReason":null,"role":"debug","flags":{"alloc":false,"execute":false,"write":false,"merge":false,"strings":false,"tls":false,"compressed":false},"virtualAddress":null,"virtualAddressUnknownReason":"this section is host metadata and is not loaded at runtime","loadAddress":"0x0","loadAddressUnknownReason":null,"fileOffset":"0x377e","fileOffsetUnknownReason":null,"fileSize":72,"memorySize":72,"memorySizeUnknownReason":null,"region":"*default*","regionUnknownReason":null},{"index":11,"name":".debug_rnglists","nameUnknownReason":null,"role":"debug","flags":{"alloc":false,"execute":false,"write":false,"merge":false,"strings":false,"tls":false,"compressed":false},"virtualAddress":null,"virtualAddressUnknownReason":"this section is host metadata and is not loaded at runtime","loadAddress":null,"loadAddressUnknownReason":"not present in the section header table","fileOffset":"0x37c6","fileOffsetUnknownReason":null,"fileSize":25,"memorySize":25,"memorySizeUnknownReason":null,"region":null,"regionUnknownReason":"no memory-region evidence was supplied"},{"index":12,"name":".debug_line","nameUnknownReason":null,"role":"debug","flags":{"alloc":false,"execute":false,"write":false,"merge":false,"strings":false,"tls":false,"compressed":false},"virtualAddress":null,"virtualAddressUnknownReason":"this section is host metadata and is not loaded at runtime","loadAddress":"0x0","loadAddressUnknownReason":null,"fileOffset":"0x37df","fileOffsetUnknownReason":null,"fileSize":421,"memorySize":421,"memorySizeUnknownReason":null,"region":"*default*","regionUnknownReason":null},{"index":13,"name":".debug_str","nameUnknownReason":null,"role":"debug","flags":{"alloc":false,"execute":false,"write":false,"merge":false,"strings":true,"tls":false,"compressed":false},"virtualAddress":null,"virtualAddressUnknownReason":"this section is host metadata and is not loaded at runtime","loadAddress":"0x0","loadAddressUnknownReason":null,"fileOffset":"0x3984","fileOffsetUnknownReason":null,"fileSize":389,"memorySize":389,"memorySizeUnknownReason":null,"region":"*default*","regionUnknownReason":null},{"index":14,"name":".comment","nameUnknownReason":null,"role":"note","flags":{"alloc":false,"execute":false,"write":false,"merge":false,"strings":true,"tls":false,"compressed":false},"virtualAddress"